{
  "$schema": "http://json-schema.org/draft-07/schema#",
  "$id": "https://filterfresh.example.com/schemas/extended-city.json",
  "title": "Filter Fresh Pools Extended City",
  "description": "Per-city data file used by /pool-filter-cleaning/[slug]. One file per city in content/cities/<slug>.json. Files starting with an underscore or named cities.json are ignored by the loader.",
  "type": "object",
  "additionalProperties": false,
  "required": [
    "name",
    "slug",
    "county",
    "tier",
    "lat",
    "lng",
    "population",
    "median_home_value",
    "pool_density_note",
    "neighborhoods",
    "zips",
    "local_landmark",
    "climate_note"
  ],
  "properties": {
    "name": { "type": "string", "minLength": 2 },
    "slug": {
      "type": "string",
      "pattern": "^[a-z0-9-]+$",
      "description": "URL slug. Must match the filename (without .json)."
    },
    "county": { "type": "string", "minLength": 2 },
    "tier": {
      "type": "integer",
      "minimum": 1,
      "maximum": 3,
      "description": "1 = launch market, 2 = expansion, 3 = serviced on request."
    },
    "lat": { "type": "number", "minimum": -90, "maximum": 90 },
    "lng": { "type": "number", "minimum": -180, "maximum": 180 },
    "population": { "type": "integer", "minimum": 0 },
    "median_home_value": {
      "type": "integer",
      "minimum": 0,
      "description": "USD. Source: any reasonable real-estate aggregate (Zillow ZHVI, Redfin)."
    },
    "pool_density_note": {
      "type": "string",
      "minLength": 40,
      "description": "1 to 2 sentences about pool ownership in this city. Avoid generic claims, prefer concrete observations (subdivision age, climate, lot size)."
    },
    "neighborhoods": {
      "type": "array",
      "minItems": 4,
      "maxItems": 8,
      "items": { "type": "string", "minLength": 2 }
    },
    "zips": {
      "type": "array",
      "minItems": 1,
      "items": { "type": "string", "pattern": "^\\d{5}$" }
    },
    "local_landmark": {
      "type": "string",
      "minLength": 4,
      "description": "Real reference point: park, school, shopping center, historic district."
    },
    "climate_note": {
      "type": "string",
      "minLength": 60,
      "description": "Microclimate detail relevant to filter buildup. Pollen sources, dust events, marine air, salt corrosion, decomposed-granite landscaping, etc."
    }
  }
}
